{
  "$schema": "https://json-schema.org/draft/2020-12/schema",
  "$id": "https://example.org/paquete-mx/schema/paquete.schema.json",
  "title": "Paquete Económico de México — año fiscal",
  "description": "Contrato de datos para un año fiscal del Paquete Económico. TODOS los montos en millones de pesos CORRIENTES del año fiscal (mdp). El sitio nunca lee números hardcodeados: todo sale de este archivo.",
  "type": "object",
  "required": ["meta", "macro", "balance", "ingresos", "gasto"],
  "additionalProperties": false,

  "$defs": {
    "nodo": {
      "type": "object",
      "required": ["id", "nombre", "monto_mdp", "confianza", "fuente"],
      "additionalProperties": false,
      "properties": {
        "id": {
          "type": "string",
          "pattern": "^[a-z0-9_]+$",
          "description": "Identificador estable entre años. NUNCA cambia aunque SHCP renombre el rubro. Es la llave con la que el sitio compara 2026 vs 2027."
        },
        "nombre": {
          "type": "string",
          "description": "Etiqueta como aparece en el documento del año en curso."
        },
        "monto_mdp": {
          "type": "number",
          "description": "Millones de pesos corrientes. Si la tabla fuente venía en miles de millones (mmp), multiplicar por 1000 y marcar confianza='derivado'."
        },
        "pct_pib": {
          "type": ["number", "null"],
          "description": "Porcentaje del PIB tal como lo publica el documento. Si no viene publicado, dejar null: el sitio lo calcula."
        },
        "confianza": {
          "type": "string",
          "enum": ["publicado", "derivado", "indicativo", "no_encontrado"],
          "description": "publicado = el número aparece literal en una tabla. derivado = lo obtuvimos por conversión de unidades o como residual. indicativo = detalle cuyo desglose puede no cuadrar exacto con el padre (redondeo o corte de clasificación distinto). no_encontrado = el rubro no venía en el documento; monto_mdp debe ser 0."
        },
        "fuente": {
          "type": "string",
          "description": "Ubicación exacta: nombre de la tabla y sección/anexo. Ej: 'Anexo II.6 Estimación de las finanzas públicas'."
        },
        "nota": {
          "type": "string",
          "description": "Advertencia metodológica visible en el tooltip del sitio."
        },
        "color_hint": {
          "type": "string",
          "enum": ["ingreso", "deuda", "gasto", "gasto_rigido", "neutro"],
          "description": "Familia de color en el Sankey. 'deuda' es el nodo del boquete."
        },
        "hijos": {
          "type": "array",
          "items": { "$ref": "#/$defs/nodo" },
          "description": "Desglose. La suma de hijos debe reconciliar con monto_mdp dentro de tolerancia."
        }
      }
    }
  },

  "properties": {
    "meta": {
      "type": "object",
      "required": ["anio_fiscal", "tipo_documento", "moneda", "unidad", "fuente_documento", "extraido_el"],
      "additionalProperties": false,
      "properties": {
        "anio_fiscal": { "type": "integer", "minimum": 2000, "maximum": 2100 },
        "tipo_documento": {
          "type": "string",
          "enum": ["PPEF", "PEF", "LIF_iniciativa", "LIF_aprobada"],
          "description": "PPEF = proyecto enviado por el Ejecutivo en septiembre. PEF = presupuesto aprobado por la Cámara en noviembre. NO son comparables entre sí: el sitio debe advertirlo."
        },
        "comparable_con": {
          "type": "array",
          "items": { "type": "string" },
          "description": "IDs de otros archivos con los que esta serie es comparable manzana-con-manzana. Ej: ['2026-PPEF']."
        },
        "moneda": { "type": "string", "const": "MXN" },
        "unidad": { "type": "string", "const": "millones_pesos_corrientes" },
        "fuente_documento": { "type": "string" },
        "url_fuente": { "type": "string" },
        "fecha_publicacion": { "type": "string" },
        "extraido_el": { "type": "string" },
        "advertencias": {
          "type": "array",
          "items": { "type": "string" },
          "description": "Se renderizan como banda arriba de la infografía."
        }
      }
    },

    "macro": {
      "type": "object",
      "required": ["pib_nominal_mdp", "deflactor_pib_pct"],
      "additionalProperties": false,
      "description": "Sin esto no hay comparación real ni cálculo de % del PIB. Es obligatorio.",
      "properties": {
        "pib_nominal_mdp": { "type": "number" },
        "deflactor_pib_pct": { "type": "number", "description": "Deflactor del PIB del año fiscal. Convierte pesos corrientes del año anterior a pesos del año en curso." },
        "crecimiento_real_pib_rango": {
          "type": "array", "items": { "type": "number" }, "minItems": 2, "maxItems": 2
        },
        "inflacion_dic_dic_pct": { "type": "number" },
        "tipo_cambio_promedio": { "type": "number" },
        "cetes28_promedio_pct": { "type": "number" },
        "precio_petroleo_usd": { "type": "number" },
        "plataforma_produccion_mbd": { "type": "number" },
        "poblacion": { "type": ["number", "null"], "description": "Para la vista 'pesos por persona'. Fuente CONAPO, no el CGPE." }
      }
    },

    "balance": {
      "type": "object",
      "required": ["balance_presupuestario_mdp", "rfsp_mdp"],
      "additionalProperties": false,
      "description": "El boquete. balance_presupuestario_mdp negativo = déficit = lo que se financia con deuda.",
      "properties": {
        "balance_presupuestario_mdp": { "type": "number" },
        "balance_presupuestario_pct_pib": { "type": ["number", "null"] },
        "requerimientos_extrapresupuestarios_mdp": { "type": "number" },
        "rfsp_mdp": { "type": "number" },
        "rfsp_pct_pib": { "type": ["number", "null"] },
        "shrfsp_mdp": { "type": "number", "description": "Saldo histórico de los RFSP: la deuda acumulada, no la del año." },
        "shrfsp_pct_pib": { "type": ["number", "null"] },
        "balance_primario_mdp": { "type": ["number", "null"] },
        "desglose_entes": {
          "type": "array",
          "items": { "$ref": "#/$defs/nodo" },
          "description": "Gobierno Federal, Pemex, CFE, IMSS, ISSSTE."
        }
      }
    },

    "ingresos": {
      "$ref": "#/$defs/nodo",
      "description": "Raíz = ingresos presupuestarios totales. NO incluye ingresos derivados de financiamiento."
    },

    "gasto": {
      "$ref": "#/$defs/nodo",
      "description": "Raíz = gasto neto total PAGADO. Usar siempre pagado, no devengado, para que cuadre la identidad del Sankey."
    },

    "clasificaciones_gasto": {
      "type": "object",
      "additionalProperties": false,
      "description": "Cortes alternativos del gasto PROGRAMABLE DEVENGADO. Son vistas paralelas, no ramas del árbol principal: cada una suma al mismo total. El sitio las ofrece como pestañas.",
      "properties": {
        "economica": { "$ref": "#/$defs/nodo" },
        "funcional": { "$ref": "#/$defs/nodo" },
        "administrativa": {
          "$ref": "#/$defs/nodo",
          "description": "Por ramo. NO viene en el CGPE: requiere datos abiertos del PPEF de Transparencia Presupuestaria. Opcional."
        }
      }
    },

    "transferencias_estados": {
      "$ref": "#/$defs/nodo",
      "description": "Participaciones + aportaciones + otros. Ojo: las participaciones ya están dentro de gasto no programable. Es una vista, no un nodo adicional."
    }
  }
}
